,0
3,"Why Bitcoin, Ethereum, and Dogecoin Crashed This Weekend The crypto market was in tatters late Sunday night after traders realized there wouldn't be a tariff reprieve before global stock markets opened Monday morning. Bitcoin (CRYPTO: BTC) fell below $100,000 and looked like it could break $90,000 before bouncing a… Dogecoin Crashes 40%, But This Analyst Sees A Bullish Setup In a dramatic reversal, Dogecoin (DOGE) plunged from around $0.34 as low as $0.20, wiping out nearly 40% of its value before finding tentative stability near $0.25 at press time. However, crypto analyst “Coosh” Alemzadeh (@AlemzadehC) maintains a bullish long… Bitcoin, XRP and Dogecoin Rebound as Trump Pauses Mexican Trade Tariffs President Trump said Monday that planned tariffs against Mexico will be delayed, reversing the slide of Bitcoin and other major coins. Better Cryptocurrency to Buy With $1,000 Right Now: Dogecoin vs. Shiba Inu It's true that both Dogecoin (CRYPTO: DOGE) and Shiba Inu (CRYPTO: SHIB) are meme coins based around cute pictures of dogs, but the two cryptocurrencies have differing factors driving their prices.
In fact, there's a clear winner in the match between these tw… Bitcoin, Dogecoin, Mantra, and more cryptocurrencies to watch this week Over the weekend, President Trump announced new tariffs on imports from the U.S.’s top trading partners—Canada, Mexico, and potentially China—triggering a decline in the cryptocurrency market. Read more... TRUMP Memecoin News: Token Drops 75% as U.S. Tariffs Pull Dogecoin, Memes Lower TRUMP Down 75% From Peak Even as Donald Trump Shills the Token on Truth Social
TRUMP was issued a couple of days before Trump’s swearing-in ceremony on Jan.20 as the first-ever memecoin officially endorsed by a sitting president.
What to know:
- A market-wide… Crypto Liquidations Cross $2.22 Billion, Here’s How Much Dogecoin Traders Lost The entire cryptocurrency market has experienced a steep decline over the past 24 hours, with its total market cap plunging by double digits following a barrage of volatile price swings. Unsurprisingly, this sharp downturn has led to widespread liquidations a… Dogecoin whale dumps, sparks 17% crash: Are bears here for DOGE? Dogecoin whales have sold another significant portion of their holdings in the past 24 hours, influencing downward pressure.
- DOGE could establish new lows as sentiment across several metrics remains bearish.
In the past 24 hours, Dogecoin [DOGE] recorded a … 208 Million Dogecoin (DOGE) Stuns Major US Exchange Coinbase Disclaimer: The opinions expressed by our writers are their own and do not represent the views of U.Today. The financial and market information provided on U.Today is intended for informational purposes only. U.Today is not liable for any financial losses inc… Dogecoin whale dumps, sparks 17% crash: Are bears here for DOGE? DOGE faces threats from major sell-offs by whales in the market. XRP, Dogecoin Plunge 25% as Crypto Liquidations Cross $2.2B on Tariffs Led Dump and Cardano’s ADA fell more than 25% to reverse all of the gains since December, reaching pre-U.S. election levels from early November. XRP, Dogecoin Plunge 25% as Crypto Liquidations Cross $2.2B on Tariffs Led Dump XRP, dogecoin (DOGE) and Cardano’s ADA fell more than 25% to reverse all of the gains since December, reaching pre-U.S. election levels from early November. Dogecoin (DOGE) Plunges to $0.20: Is This the Bottom or More Pain Ahead? Dogecoin declined heavily below the $0.280 support against the US Dollar. DOGE is now recovering and might face hurdles near $0.270. DOGE price started a fresh decline below the $0.2850 and $0.2650 support levels. The price is trading below the $0.280 level a… XRP, Solana and Dogecoin Crash as Trump's Trade War Knocks Bitcoin Under $97K Some of the most valuable cryptocurrencies have plunged by 10% or more over the past day amid fears that a trade war fueled by President Donald Trump's tariffs on major trading partners will negatively impact risk assets.
Bitcoin is now trading for $96,879, d… Bitcoin, Ripple’s XRP, Solana, and Dogecoin Fall Hard As President Trump Launches New Trade War Altcoins fared far worse than Bitcoin as Trump started a trade war with the U.S.’s biggest trading partners. XRP, Solana and Dogecoin Crash as Trump's Trade War Knocks Bitcoin Under $97K Crypto prices are crashing as President Trump suggests ""pain"" ahead for Americans in his brewing trade war, with Bitcoin under $97,000. Is Dogecoin Mirroring Pepe? A Drop To $0.2 Could Be Imminent For DOGE has enjoyed extra attention from investors, especially since Donald Trump took office and put Elon Musk in charge of D.O.G.E. — an acronym for Department of Government Efficiency. However, this interesting relationship is not particularly reflected in the pri… Crypto ETF Floodgates Will Open If SEC Crosses Regulatory 'Rubicon' for XRP, Solana and Dogecoin: Analyst The SEC has placed an importance on regulated futures markets for past crypto ETF approvals. Dogecoin ETF rumors spark hype – Will it help DOGE hit $1? Dogecoin is signaling a major breakout with bullish patterns and potential ETF approval driving excitement. Third Dogecoin ETF Filing Goes Live From Grayscale – Is DOGE Gearing Up For Rally To $1? Asset manager Grayscale has become the third to file to offer a Dogecoin ETF, sparking a bullish sentiment in the DOGE community. This development has also raised the possibility of the Dogecoin price rallying to $1 soon enough.
Grayscale’s Dogecoin ETF Filin… TRUMP Solana Token Falls After President's 'Pump' Post, While Bitcoin and Dogecoin Dip ""I LOVE $TRUMP,"" the United States President posted about his Solana meme coin. It only fell harder, amid criticism over the promotion. Here's Why Dogecoin, Shiba Inu, And XRP Crashed Again | Bitcoinist.com , Shiba Inu (SHIB), and XRP have unexpectedly crashed again, experiencing another bout of bearish momentum and starting February in the negative. This significant decline was driven by a major drop in the Bitcoin price following Donald Trump’s Tariff plans an… Is Dogecoin Mirroring Pepe? A Drop To $0.2 Could Be Imminent For DOGE Dogecoin (DOGE) has enjoyed extra attention from investors, especially since Donald Trump took office and put Elon Musk in charge of D.O.G.E. — an acronym for Department of Government Efficiency. However, this interesting relationship is not particularly refl… Why Are Bitcoin, XRP, and Dogecoin Prices Falling Today? Highlights
- Bitcoin price is falling as $100,000 support breach looms
- Altcoins joined the downtrend with XRP and Dogecoin leading the selloff
- Market trend suggests a shakeup is imminent as traders weigh fundamentals
The crypto market is experiencing anot… THIS is how Dogecoin can lead the memecoin market comeback The orders imbalance was skewed toward the buyers in the 10% space, pointing to a bullish short-term reversal. Double Bottom Pattern Suggests Dogecoin May Lead Crypto Market Gains This Month Technical analysis of the Dogecoin price shows that the meme coin might be gearing up to outperform the market this month. Particularly, technical analysis of the Dogecoin/Bitcoin pair shows that an interesting bullish pattern has just emerged that could send… Dogecoin Whales Go Ham As They Buy 560 Million DOGE In One Week Dogecoin whales are making moves again, scooping up a whopping 560 million DOGE tokens in just one week, as market conditions become more favorable. This large-scale purchase underscores the renewed interest and growing confidence in Dogecoin’s future potenti… Dogecoin whales acquire 560M DOGE after more ETF speculations Whales scooped 560 million DOGE amid its latest price dip
- Will Grayscale’s DOGE ETF application fuel recovery odds?
The original memecoin, Dogecoin [DOGE], continues to attract whale and institutional interest. Especially amid significant Spot ETF speculati… Dogecoin whales acquire 560M DOGE after more ETF speculations Whales scooped 560 million DOGE amid its latest price dip
- Will Grayscale’s DOGE ETF application fuel recovery odds?
The original memecoin, Dogecoin [DOGE], continues to attract whale and institutional interest. Especially amid significant Spot ETF speculati… 560 Million Dogecoin in Days: What’s Happening? Disclaimer: The opinions expressed by our writers are their own and do not represent the views of U.Today. The financial and market information provided on U.Today is intended for informational purposes only. U.Today is not liable for any financial losses inc… Dogecoin whales acquire 560M DOGE after more ETF speculations Polymarket's odds of a U.S Spot DOGE ETF surged to a record high of 58%. Dogecoin Whales Go Ham As They Buy 560 Million DOGE In One Week Dogecoin whales are making moves again, scooping up a whopping 560 million DOGE tokens in just one week, as market conditions become more favorable. This large-scale purchase underscores the renewed interest and growing confidence in Dogecoin’s future potenti… Here’s Why Dogecoin, Shiba Inu, And XRP Crashed Again Dogecoin (DOGE), Shiba Inu (SHIB), and XRP have unexpectedly crashed again, experiencing another bout of bearish momentum and starting February in the negative. This significant decline was driven by a major drop in the Bitcoin price following Donald Trump’s … Third Dogecoin ETF Filing Goes Live From Grayscale – Is DOGE Gearing Up For Rally To $1? Asset manager Grayscale has become the third to file to offer a Dogecoin ETF, sparking a bullish sentiment in the DOGE community. This development has also raised the possibility of the Dogecoin price rallying to $1 soon enough.  Related Reading: Trump Effect… Analyst Says Dogecoin Is Yet To Complete 5th Wave, Here’s How High It Must Go Dogecoin has continued its weekly decline into the past 24 hours, with the price action looking like a continued consolidation below $0.35, at least in the next few days. However, bullish sentiment continues to linger for Dogecoin, and technical analysis sugg… Dogecoin ETF Race Intensifies As Grayscale Joins The Chase In an exciting development, the race for the Dogecoin ETF in the US is gaining serious momentum as prominent asset manager Grayscale has now joined the fray.
Grayscale Seeks To Convert Dogecoin Trust To ETF
On Friday, Grayscale announced the launch of a new D… Dogecoin ETF Race Intensifies As Grayscale Joins The Chase In an exciting development, the race for the Dogecoin ETF in the US is gaining serious momentum as prominent asset manager Grayscale has now joined the fray. Related Reading: Dogecoin Poised To Spearhead Altcoin Season As DOGE.D/BTC.D Forms Bullish Chart Patt… Grayscale Launches New Dogecoin Trust — Then Quickly Files To Convert It Into DOGE ETF Grayscale, the world’s leading crypto asset manager, has unveiled a product aimed at offering investors exposure to Dogecoin (DOGE). Better Meme Coin to Buy: Dogecoin vs. Official Trump Both Dogecoin (CRYPTO: DOGE) and the Official Trump meme coin, with the ticker TRUMP, are among the most well-known meme plays out there at the moment. But, contrary to what you may have heard, not all meme coins are the same in terms of their balance of risk… Better Meme Coin to Buy: Dogecoin vs. Official Trump None Crypto Pundit Says Dogecoin Price At $1 Is Only A ‘Matter Of Time’ Dogecoin’s price movement remains a matter of discussion among crypto traders on social media, with a well-known analyst pointing to a major breakout pattern that could send DOGE soaring toward $1. Popular crypto analyst Lucky (@LLuciano_BTC) recently shared … NYSE files to list and trade Grayscale’s spot Dogecoin ETF The listing could enhance Dogecoin's legitimacy and accessibility, potentially influencing broader cryptocurrency market dynamics and investor interest.
The post NYSE files to list and trade Grayscale’s spot Dogecoin ETF appeared first on Crypto Briefing. Grayscale Launches Dogecoin Trust Key Takeaways
- Digital asset manager has launched an investment trust for the meme coin Dogecoin.
- Bitwise has also filed for the launch of a Dogecoin ETF with the SEC.
- Meme coins are having a moment with U.S. President Donald Trump even launching his own… Grayscale Investments® Launches Grayscale® Dogecoin Trust STAMFORD, Conn., Jan. 31, 2025 (GLOBE NEWSWIRE) -- Grayscale Investments®, a leading crypto asset management firm, offering more than 25 crypto investment products, today announced the creation and launch of Grayscale® Dogecoin Trust (the “Trust”).
The Trust … Dogecoin Poised To Spearhead Altcoin Season As DOGE.D/BTC.D Forms Bullish Chart Pattern Dogecoin has shown remarkable growth in the ongoing bull cycle. Many crypto enthusiasts continue to demonstrate robust confidence in the DOGE’s potential as they predict a major growth for the dog-themed meme coin in the short term, allowing it to catalyze a … Bitcoin, XRP and Dogecoin Fall Fast as Trump Tariffs Confirmed The price of Bitcoin dove Friday after President Trump’s team confirmed that tariffs on China, Mexico, and Canada are imminent. This Dogecoin and Shiba Inu Rival Is Mirroring Price Action That Previously Triggered 200% Rally, Says Trader A widely followed crypto analyst says that one rival of dog-themed meme assets Dogecoin (DOGE) and Shiba Inu (SHIB) is repeating a move it did previously that caused it to spark a 200% rally. In a new strategy session, pseudonymous crypto trader Inmortal tell… Crypto Investment Giant Grayscale Announces Launch of New Dogecoin (DOGE) Trust Crypto asset management firm Grayscale is announcing the launch of a new trust that would give investors access to the popular meme asset Dogecoin (DOGE). In a new press release, the investment giant says it is creating the Grayscale Dogecoin Trust as it beli… Grayscale Launches Dogecoin Trust None Grayscale launches trust for institutional access to Dogecoin Grayscale Investments announced the launch of the Grayscale Dogecoin Trust on Jan. 30, marking a significant milestone in institutional access to Dogecoin, the crypto initially created as a joke but now valued at billions. The new single-asset fund offers acc… Dogecoin price prediction – Assessing if a breach of $0.36 is next Dogecoin has broken out of a symmetrical triangle pattern, signaling potential growth and higher resistance levels. Grayscale launches Dogecoin Trust, calling memecoin tool for ‘global financial inclusion’ DOGE is the largest memecoin and the eighth largest cryptocurrency, with a market capitalization of over $50 billion."
